enunciado;resposta;justificativa
"Uma thread pode ler ou até mesmo apagar a pilha de outra thread que pertence ao mesmo processo.";True;"Verdadeiro — Como compartilham o mesmo espaço de endereçamento, uma thread maliciosa ou com bug pode acessar e corromper a pilha de outra, sendo uma fonte comum de erros."
"A chamada pthread_join é usada para criar uma nova thread.";False;"Falso — pthread_join faz com que uma thread espere pelo término de outra. Para criar uma nova thread, utiliza-se pthread_create."
"Nos monitores, a exclusão mútua é garantida implicitamente pela estrutura da linguagem, tornando o código menos propenso a erros.";True;"Verdadeiro — A estrutura do monitor garante que apenas uma thread possa estar ativa dentro de seus procedimentos por vez, simplificando a programação e evitando erros comuns."
"A alternância estrita (explicit alternation) é uma solução eficiente e flexível para o problema da região crítica.";False;"Falso — A alternância estrita é inflexível (viola o progresso se um processo for mais lento) e pode ser ineficiente."
"No problema do produtor-consumidor, um 'wakeup perdido' pode ocorrer se o consumidor for interrompido logo após verificar que o buffer está vazio, mas antes de dormir.";True;"Verdadeiro — É um problema clássico de sincronização. O produtor pode sinalizar o wakeup enquanto o consumidor está prestes a dormir, fazendo com que o sinal seja perdido."
"O uso da instrução TSL (Test-and-Set Lock) elimina a necessidade de um laço de repetição (espera ocupada).";False;"Falso — A instrução TSL é usada dentro de um laço de espera ocupada para garantir que a verificação e o bloqueio da variável de trava sejam atômicos."
"A principal vantagem de desabilitar interrupções para garantir exclusão mútua é que essa solução funciona perfeitamente em sistemas com múltiplos processadores.";False;"Falso — Desabilitar interrupções não funciona em sistemas multiprocessados, pois a instrução afeta apenas o núcleo onde foi executada, não os outros."
"A herança de prioridade é uma técnica onde uma tarefa de baixa prioridade herda a prioridade de uma tarefa de média prioridade que a está bloqueando.";False;"Falso — A herança de prioridade ocorre quando uma tarefa de baixa prioridade herda a prioridade da tarefa de ALTA prioridade que ela está bloqueando, para que possa liberar o recurso rapidamente."
"Um sistema de tempo real não-crítico (soft) pode tolerar o descumprimento ocasional de um prazo.";True;"Verdadeiro — Sistemas de tempo real 'soft' (ex: streaming de vídeo) visam cumprir os prazos, mas falhas ocasionais não são catastróficas e apenas degradam a qualidade."
"O algoritmo de escalonamento FCFS (Primeiro a Chegar, Primeiro a Ser Servido) pode causar o 'efeito comboio'.";True;"Verdadeiro — O 'efeito comboio' ocorre quando um processo longo chega primeiro e todos os processos curtos que chegam depois são forçados a esperar, mesmo sendo rápidos."
"O 'quantum' no escalonamento Round-Robin é o tempo total que um processo pode usar a CPU antes de terminar.";False;"Falso — O quantum é a fatia de tempo máxima que um processo pode usar a CPU antes de ser preemptado e devolvido para o final da fila de prontos."
"O objetivo de uma LibOS em um sistema Exokernel é fornecer acesso direto e desprotegido ao hardware.";False;"Falso — A LibOS (biblioteca de sistema operacional) em um Exokernel fornece as abstrações de alto nível (como arquivos), enquanto o kernel apenas multiplexa o hardware de forma segura."
"Unikernel combina a aplicação e as bibliotecas de SO necessárias em uma única imagem de máquina, visando máxima segurança e mínimo tamanho.";True;"Verdadeiro — Unikernels são imagens de máquina especializadas, contendo apenas o código da aplicação e as dependências do SO necessárias, ideais para ambientes de nuvem e virtualização."
"O conceito de 'Política versus Mecanismo' sugere que o sistema operacional deve sempre impor tanto as ferramentas de gerenciamento quanto a forma como elas são usadas.";False;"Falso — O ideal é que o SO forneça o 'mecanismo' (as ferramentas, ex: escalonador com prioridades) e o usuário defina a 'política' (como usar as ferramentas, ex: quais prioridades atribuir)."